{
  "$schema": "../../schemas/block_manifest.schema.json",
  "schema_version": 1,
  "block": {
    "name": "affine_blit_engine_axi_stream",
    "entity": "affine_blit_engine_axi_stream",
    "version": "3.0.0",
    "category": "2d_graphics",
    "source": "rtl/blocks/2d_graphics/affine_blit_engine_axi_stream.vhd",
    "wrapper_entity": "affine_blit_engine_axi_stream_det_cfg"
  },
  "configuration": {
    "id": "AFFINE_BLIT_ENGINE_AXI_STREAM_F93335EA817EA602",
    "hash_algorithm": "sha256-64",
    "locked": true,
    "generics": [
      {
        "name": "DATA_WIDTH",
        "type": "positive",
        "default": "24",
        "minimum": 1
      },
      {
        "name": "GAIN_SHIFT",
        "type": "natural",
        "default": "0",
        "minimum": 0
      }
    ],
    "resolved_defaults": {
      "DATA_WIDTH": 24,
      "GAIN_SHIFT": 0
    }
  },
  "interface": {
    "ports": [
      {
        "name": "clk",
        "direction": "in",
        "type": "std_logic"
      },
      {
        "name": "rst_n",
        "direction": "in",
        "type": "std_logic"
      },
      {
        "name": "sample_in",
        "direction": "in",
        "type": "std_logic_vector(DATA_WIDTH-1 downto 0)"
      },
      {
        "name": "in_valid",
        "direction": "in",
        "type": "std_logic"
      },
      {
        "name": "in_ready",
        "direction": "out",
        "type": "std_logic"
      },
      {
        "name": "sample_out",
        "direction": "out",
        "type": "std_logic_vector(DATA_WIDTH-1 downto 0)"
      },
      {
        "name": "out_valid",
        "direction": "out",
        "type": "std_logic"
      },
      {
        "name": "out_ready",
        "direction": "in",
        "type": "std_logic"
      }
    ],
    "clock_ports": [
      "clk"
    ],
    "reset_ports": [
      "rst_n"
    ]
  },
  "contracts": {
    "latency": {
      "kind": "declared_by_block_family",
      "cycles": null
    },
    "throughput": {
      "kind": "declared_by_block_family",
      "transactions_per_cycle": null
    },
    "reset": {
      "policy": "preserve_source_entity_contract"
    },
    "cdc": {
      "status": "single_clock_default; integration CDC review required",
      "clock_domain_count": 1
    },
    "protocol": {
      "status": "not_applicable_or_internal_contract"
    },
    "numerical": {
      "status": "shared-core surrogate only; block-specific golden model and numerical qualification required."
    }
  },
  "maturity": {
    "implementation_tier": "B",
    "verification": "interface-wrapper smoke-test scaffold; named algorithm/architecture not yet qualified.",
    "timing": "requires synthesis, place-and-route, and constraints for the selected FPGA/clock"
  },
  "generation": {
    "wrapper_path": "generated/default_wrappers/2d_graphics/affine_blit_engine_axi_stream_det_cfg.vhd",
    "configuration_file": "configurations/default/affine_blit_engine_axi_stream.json"
  }
}
