{
  "$schema": "../../schemas/block_manifest.schema.json",
  "schema_version": 1,
  "block": {
    "name": "hmac_engine_fault_detecting",
    "entity": "hmac_engine_fault_detecting",
    "version": "3.0.0",
    "category": "cryptography",
    "source": "rtl/blocks/cryptography/hmac_engine_fault_detecting.vhd",
    "wrapper_entity": "hmac_engine_fault_detecting_det_cfg"
  },
  "configuration": {
    "id": "HMAC_ENGINE_FAULT_DETECTING_1B65B2E6A056E235",
    "hash_algorithm": "sha256-64",
    "locked": true,
    "generics": [
      {
        "name": "DATA_WIDTH",
        "type": "positive",
        "default": "128",
        "minimum": 1
      },
      {
        "name": "KEY_WIDTH",
        "type": "positive",
        "default": "128",
        "minimum": 1
      }
    ],
    "resolved_defaults": {
      "DATA_WIDTH": 128,
      "KEY_WIDTH": 128
    }
  },
  "interface": {
    "ports": [
      {
        "name": "clk",
        "direction": "in",
        "type": "std_logic"
      },
      {
        "name": "rst_n",
        "direction": "in",
        "type": "std_logic"
      },
      {
        "name": "data_in",
        "direction": "in",
        "type": "std_logic_vector(DATA_WIDTH-1 downto 0)"
      },
      {
        "name": "key_in",
        "direction": "in",
        "type": "std_logic_vector(KEY_WIDTH-1 downto 0)"
      },
      {
        "name": "in_valid",
        "direction": "in",
        "type": "std_logic"
      },
      {
        "name": "in_ready",
        "direction": "out",
        "type": "std_logic"
      },
      {
        "name": "data_out",
        "direction": "out",
        "type": "std_logic_vector(DATA_WIDTH-1 downto 0)"
      },
      {
        "name": "out_valid",
        "direction": "out",
        "type": "std_logic"
      },
      {
        "name": "out_ready",
        "direction": "in",
        "type": "std_logic"
      },
      {
        "name": "fault",
        "direction": "out",
        "type": "std_logic"
      }
    ],
    "clock_ports": [
      "clk"
    ],
    "reset_ports": [
      "rst_n"
    ]
  },
  "contracts": {
    "latency": {
      "kind": "declared_by_block_family",
      "cycles": null
    },
    "throughput": {
      "kind": "declared_by_block_family",
      "transactions_per_cycle": null
    },
    "reset": {
      "policy": "preserve_source_entity_contract"
    },
    "cdc": {
      "status": "single_clock_default; integration CDC review required",
      "clock_domain_count": 1
    },
    "protocol": {
      "status": "integration_shell_only; external compliant controller/PHY/VIP required"
    },
    "numerical": {
      "status": "application-specific; reference model required"
    }
  },
  "maturity": {
    "implementation_tier": "C",
    "verification": "static-validated source; run supplied GHDL regression before release.",
    "timing": "requires synthesis, place-and-route, and constraints for the selected FPGA/clock"
  },
  "generation": {
    "wrapper_path": "generated/default_wrappers/cryptography/hmac_engine_fault_detecting_det_cfg.vhd",
    "configuration_file": "configurations/default/hmac_engine_fault_detecting.json"
  }
}
