{
  "$schema": "../../schemas/block_manifest.schema.json",
  "schema_version": 1,
  "block": {
    "name": "pcie_endpoint_wrapper_target",
    "entity": "pcie_endpoint_wrapper_target",
    "version": "3.0.0",
    "category": "pci_express",
    "source": "rtl/blocks/pci_express/pcie_endpoint_wrapper_target.vhd",
    "wrapper_entity": "pcie_endpoint_wrapper_target_det_cfg"
  },
  "configuration": {
    "id": "PCIE_ENDPOINT_WRAPPER_TARGET_C8A636A64BEB7A71",
    "hash_algorithm": "sha256-64",
    "locked": true,
    "generics": [
      {
        "name": "DATA_WIDTH",
        "type": "positive",
        "default": "32",
        "minimum": 1
      },
      {
        "name": "STATUS_WIDTH",
        "type": "positive",
        "default": "16",
        "minimum": 1
      }
    ],
    "resolved_defaults": {
      "DATA_WIDTH": 32,
      "STATUS_WIDTH": 16
    }
  },
  "interface": {
    "ports": [
      {
        "name": "clk",
        "direction": "in",
        "type": "std_logic"
      },
      {
        "name": "rst_n",
        "direction": "in",
        "type": "std_logic"
      },
      {
        "name": "phy_rx",
        "direction": "in",
        "type": "std_logic"
      },
      {
        "name": "phy_tx",
        "direction": "out",
        "type": "std_logic"
      },
      {
        "name": "phy_oe",
        "direction": "out",
        "type": "std_logic"
      },
      {
        "name": "tx_data",
        "direction": "in",
        "type": "std_logic_vector(DATA_WIDTH-1 downto 0)"
      },
      {
        "name": "tx_valid",
        "direction": "in",
        "type": "std_logic"
      },
      {
        "name": "tx_ready",
        "direction": "out",
        "type": "std_logic"
      },
      {
        "name": "rx_data",
        "direction": "out",
        "type": "std_logic_vector(DATA_WIDTH-1 downto 0)"
      },
      {
        "name": "rx_valid",
        "direction": "out",
        "type": "std_logic"
      },
      {
        "name": "status",
        "direction": "out",
        "type": "std_logic_vector(STATUS_WIDTH-1 downto 0)"
      }
    ],
    "clock_ports": [
      "clk"
    ],
    "reset_ports": [
      "rst_n"
    ]
  },
  "contracts": {
    "latency": {
      "kind": "declared_by_block_family",
      "cycles": null
    },
    "throughput": {
      "kind": "declared_by_block_family",
      "transactions_per_cycle": null
    },
    "reset": {
      "policy": "preserve_source_entity_contract"
    },
    "cdc": {
      "status": "single_clock_default; integration CDC review required",
      "clock_domain_count": 1
    },
    "protocol": {
      "status": "integration_shell_only; external compliant controller/PHY/VIP required"
    },
    "numerical": {
      "status": "application-specific; reference model required"
    }
  },
  "maturity": {
    "implementation_tier": "C",
    "verification": "static-validated source; run supplied GHDL regression before release.",
    "timing": "requires synthesis, place-and-route, and constraints for the selected FPGA/clock"
  },
  "generation": {
    "wrapper_path": "generated/default_wrappers/pci_express/pcie_endpoint_wrapper_target_det_cfg.vhd",
    "configuration_file": "configurations/default/pcie_endpoint_wrapper_target.json"
  }
}
