{
  "$schema": "../../schemas/block_manifest.schema.json",
  "schema_version": 1,
  "block": {
    "name": "raid_xor_engine_write_through",
    "entity": "raid_xor_engine_write_through",
    "version": "3.0.0",
    "category": "advanced_storage",
    "source": "rtl/blocks/advanced_storage/raid_xor_engine_write_through.vhd",
    "wrapper_entity": "raid_xor_engine_write_through_det_cfg"
  },
  "configuration": {
    "id": "RAID_XOR_ENGINE_WRITE_THROUGH_B7A1F2C95B87BAAA",
    "hash_algorithm": "sha256-64",
    "locked": true,
    "generics": [
      {
        "name": "ADDR_WIDTH",
        "type": "positive",
        "default": "32",
        "minimum": 1
      },
      {
        "name": "DATA_WIDTH",
        "type": "positive",
        "default": "32",
        "minimum": 1
      }
    ],
    "resolved_defaults": {
      "ADDR_WIDTH": 32,
      "DATA_WIDTH": 32
    }
  },
  "interface": {
    "ports": [
      {
        "name": "clk",
        "direction": "in",
        "type": "std_logic"
      },
      {
        "name": "rst_n",
        "direction": "in",
        "type": "std_logic"
      },
      {
        "name": "start",
        "direction": "in",
        "type": "std_logic"
      },
      {
        "name": "src_addr",
        "direction": "in",
        "type": "std_logic_vector(ADDR_WIDTH-1 downto 0)"
      },
      {
        "name": "dst_addr",
        "direction": "in",
        "type": "std_logic_vector(ADDR_WIDTH-1 downto 0)"
      },
      {
        "name": "data_in",
        "direction": "in",
        "type": "std_logic_vector(DATA_WIDTH-1 downto 0)"
      },
      {
        "name": "data_out",
        "direction": "out",
        "type": "std_logic_vector(DATA_WIDTH-1 downto 0)"
      },
      {
        "name": "busy",
        "direction": "out",
        "type": "std_logic"
      },
      {
        "name": "done",
        "direction": "out",
        "type": "std_logic"
      },
      {
        "name": "error",
        "direction": "out",
        "type": "std_logic"
      }
    ],
    "clock_ports": [
      "clk"
    ],
    "reset_ports": [
      "rst_n"
    ]
  },
  "contracts": {
    "latency": {
      "kind": "declared_by_block_family",
      "cycles": null
    },
    "throughput": {
      "kind": "declared_by_block_family",
      "transactions_per_cycle": null
    },
    "reset": {
      "policy": "preserve_source_entity_contract"
    },
    "cdc": {
      "status": "single_clock_default; integration CDC review required",
      "clock_domain_count": 1
    },
    "protocol": {
      "status": "not_applicable_or_internal_contract"
    },
    "numerical": {
      "status": "shared-core surrogate only; block-specific golden model and numerical qualification required."
    }
  },
  "maturity": {
    "implementation_tier": "B",
    "verification": "interface-wrapper smoke-test scaffold; named algorithm/architecture not yet qualified.",
    "timing": "requires synthesis, place-and-route, and constraints for the selected FPGA/clock"
  },
  "generation": {
    "wrapper_path": "generated/default_wrappers/advanced_storage/raid_xor_engine_write_through_det_cfg.vhd",
    "configuration_file": "configurations/default/raid_xor_engine_write_through.json"
  }
}
