{
  "$schema": "../../schemas/block_manifest.schema.json",
  "schema_version": 1,
  "block": {
    "name": "depthwise_convolution_engine_int16",
    "entity": "depthwise_convolution_engine_int16",
    "version": "3.0.0",
    "category": "machine_learning",
    "source": "rtl/blocks/machine_learning/depthwise_convolution_engine_int16.vhd",
    "wrapper_entity": "depthwise_convolution_engine_int16_det_cfg"
  },
  "configuration": {
    "id": "DEPTHWISE_CONVOLUTION_ENGINE_INT16_A1E0D2697F2C7703",
    "hash_algorithm": "sha256-64",
    "locked": true,
    "generics": [
      {
        "name": "ELEM_WIDTH",
        "type": "positive",
        "default": "8",
        "minimum": 1
      },
      {
        "name": "LANES",
        "type": "positive",
        "default": "4",
        "minimum": 1
      },
      {
        "name": "ACC_WIDTH",
        "type": "positive",
        "default": "32",
        "minimum": 1
      }
    ],
    "resolved_defaults": {
      "ELEM_WIDTH": 8,
      "LANES": 4,
      "ACC_WIDTH": 32
    }
  },
  "interface": {
    "ports": [
      {
        "name": "clk",
        "direction": "in",
        "type": "std_logic"
      },
      {
        "name": "rst_n",
        "direction": "in",
        "type": "std_logic"
      },
      {
        "name": "vector_a",
        "direction": "in",
        "type": "std_logic_vector(LANES*ELEM_WIDTH-1 downto 0)"
      },
      {
        "name": "vector_b",
        "direction": "in",
        "type": "std_logic_vector(LANES*ELEM_WIDTH-1 downto 0)"
      },
      {
        "name": "in_valid",
        "direction": "in",
        "type": "std_logic"
      },
      {
        "name": "in_ready",
        "direction": "out",
        "type": "std_logic"
      },
      {
        "name": "result",
        "direction": "out",
        "type": "std_logic_vector(ACC_WIDTH-1 downto 0)"
      },
      {
        "name": "out_valid",
        "direction": "out",
        "type": "std_logic"
      },
      {
        "name": "out_ready",
        "direction": "in",
        "type": "std_logic"
      }
    ],
    "clock_ports": [
      "clk"
    ],
    "reset_ports": [
      "rst_n"
    ]
  },
  "contracts": {
    "latency": {
      "kind": "declared_by_block_family",
      "cycles": null
    },
    "throughput": {
      "kind": "declared_by_block_family",
      "transactions_per_cycle": null
    },
    "reset": {
      "policy": "preserve_source_entity_contract"
    },
    "cdc": {
      "status": "single_clock_default; integration CDC review required",
      "clock_domain_count": 1
    },
    "protocol": {
      "status": "not_applicable_or_internal_contract"
    },
    "numerical": {
      "status": "parameterized_integer/fixed-point reference behavior; quantify error against system model"
    }
  },
  "maturity": {
    "implementation_tier": "B",
    "verification": "static-validated source; run supplied GHDL regression before release.",
    "timing": "requires synthesis, place-and-route, and constraints for the selected FPGA/clock"
  },
  "generation": {
    "wrapper_path": "generated/default_wrappers/machine_learning/depthwise_convolution_engine_int16_det_cfg.vhd",
    "configuration_file": "configurations/default/depthwise_convolution_engine_int16.json"
  }
}
