{
  "$schema": "../../schemas/block_manifest.schema.json",
  "schema_version": 1,
  "block": {
    "name": "stencil_test_unit_low_latency",
    "entity": "stencil_test_unit_low_latency",
    "version": "3.0.0",
    "category": "gpu_pixel",
    "source": "rtl/blocks/gpu_pixel/stencil_test_unit_low_latency.vhd",
    "wrapper_entity": "stencil_test_unit_low_latency_det_cfg"
  },
  "configuration": {
    "id": "STENCIL_TEST_UNIT_LOW_LATENCY_949B94011B0C8336",
    "hash_algorithm": "sha256-64",
    "locked": true,
    "generics": [
      {
        "name": "DATA_WIDTH",
        "type": "positive",
        "default": "24",
        "minimum": 1
      },
      {
        "name": "GAIN_SHIFT",
        "type": "natural",
        "default": "0",
        "minimum": 0
      }
    ],
    "resolved_defaults": {
      "DATA_WIDTH": 24,
      "GAIN_SHIFT": 0
    }
  },
  "interface": {
    "ports": [
      {
        "name": "clk",
        "direction": "in",
        "type": "std_logic"
      },
      {
        "name": "rst_n",
        "direction": "in",
        "type": "std_logic"
      },
      {
        "name": "sample_in",
        "direction": "in",
        "type": "std_logic_vector(DATA_WIDTH-1 downto 0)"
      },
      {
        "name": "in_valid",
        "direction": "in",
        "type": "std_logic"
      },
      {
        "name": "in_ready",
        "direction": "out",
        "type": "std_logic"
      },
      {
        "name": "sample_out",
        "direction": "out",
        "type": "std_logic_vector(DATA_WIDTH-1 downto 0)"
      },
      {
        "name": "out_valid",
        "direction": "out",
        "type": "std_logic"
      },
      {
        "name": "out_ready",
        "direction": "in",
        "type": "std_logic"
      }
    ],
    "clock_ports": [
      "clk"
    ],
    "reset_ports": [
      "rst_n"
    ]
  },
  "contracts": {
    "latency": {
      "kind": "declared_by_block_family",
      "cycles": null
    },
    "throughput": {
      "kind": "declared_by_block_family",
      "transactions_per_cycle": null
    },
    "reset": {
      "policy": "preserve_source_entity_contract"
    },
    "cdc": {
      "status": "single_clock_default; integration CDC review required",
      "clock_domain_count": 1
    },
    "protocol": {
      "status": "not_applicable_or_internal_contract"
    },
    "numerical": {
      "status": "application-specific; reference model required"
    }
  },
  "maturity": {
    "implementation_tier": "B",
    "verification": "static-validated source; run supplied GHDL regression before release.",
    "timing": "requires synthesis, place-and-route, and constraints for the selected FPGA/clock"
  },
  "generation": {
    "wrapper_path": "generated/default_wrappers/gpu_pixel/stencil_test_unit_low_latency_det_cfg.vhd",
    "configuration_file": "configurations/default/stencil_test_unit_low_latency.json"
  }
}
