{
  "$schema": "../../schemas/block_manifest.schema.json",
  "schema_version": 1,
  "block": {
    "name": "tensor_reorder_buffer_bf16",
    "entity": "tensor_reorder_buffer_bf16",
    "version": "3.0.0",
    "category": "quantization_and_sparsity",
    "source": "rtl/blocks/quantization_and_sparsity/tensor_reorder_buffer_bf16.vhd",
    "wrapper_entity": "tensor_reorder_buffer_bf16_det_cfg"
  },
  "configuration": {
    "id": "TENSOR_REORDER_BUFFER_BF16_1E044D9A21B2E518",
    "hash_algorithm": "sha256-64",
    "locked": true,
    "generics": [
      {
        "name": "DATA_WIDTH",
        "type": "positive",
        "default": "32",
        "minimum": 1
      },
      {
        "name": "DEPTH",
        "type": "positive",
        "default": "16",
        "minimum": 1
      }
    ],
    "resolved_defaults": {
      "DATA_WIDTH": 32,
      "DEPTH": 16
    }
  },
  "interface": {
    "ports": [
      {
        "name": "clk",
        "direction": "in",
        "type": "std_logic"
      },
      {
        "name": "rst_n",
        "direction": "in",
        "type": "std_logic"
      },
      {
        "name": "wr_en",
        "direction": "in",
        "type": "std_logic"
      },
      {
        "name": "wr_data",
        "direction": "in",
        "type": "std_logic_vector(DATA_WIDTH-1 downto 0)"
      },
      {
        "name": "full",
        "direction": "out",
        "type": "std_logic"
      },
      {
        "name": "almost_full",
        "direction": "out",
        "type": "std_logic"
      },
      {
        "name": "rd_en",
        "direction": "in",
        "type": "std_logic"
      },
      {
        "name": "rd_data",
        "direction": "out",
        "type": "std_logic_vector(DATA_WIDTH-1 downto 0)"
      },
      {
        "name": "empty",
        "direction": "out",
        "type": "std_logic"
      },
      {
        "name": "almost_empty",
        "direction": "out",
        "type": "std_logic"
      },
      {
        "name": "level",
        "direction": "out",
        "type": "std_logic_vector(clog2(DEPTH+1)-1 downto 0)"
      }
    ],
    "clock_ports": [
      "clk"
    ],
    "reset_ports": [
      "rst_n"
    ]
  },
  "contracts": {
    "latency": {
      "kind": "declared_by_block_family",
      "cycles": null
    },
    "throughput": {
      "kind": "declared_by_block_family",
      "transactions_per_cycle": null
    },
    "reset": {
      "policy": "preserve_source_entity_contract"
    },
    "cdc": {
      "status": "single_clock_default; integration CDC review required",
      "clock_domain_count": 1
    },
    "protocol": {
      "status": "not_applicable_or_internal_contract"
    },
    "numerical": {
      "status": "parameterized_integer/fixed-point reference behavior; quantify error against system model"
    }
  },
  "maturity": {
    "implementation_tier": "A",
    "verification": "static-validated source; run supplied GHDL regression before release.",
    "timing": "requires synthesis, place-and-route, and constraints for the selected FPGA/clock"
  },
  "generation": {
    "wrapper_path": "generated/default_wrappers/quantization_and_sparsity/tensor_reorder_buffer_bf16_det_cfg.vhd",
    "configuration_file": "configurations/default/tensor_reorder_buffer_bf16.json"
  }
}
