{
  "$schema": "../../schemas/block_manifest.schema.json",
  "schema_version": 1,
  "block": {
    "name": "threshold_detector",
    "entity": "threshold_detector",
    "version": "3.0.0",
    "category": "sensors_and_instrumentation",
    "source": "rtl/blocks/sensors_and_instrumentation/threshold_detector.vhd",
    "wrapper_entity": "threshold_detector_det_cfg"
  },
  "configuration": {
    "id": "THRESHOLD_DETECTOR_330E4865BAC947F8",
    "hash_algorithm": "sha256-64",
    "locked": true,
    "generics": [
      {
        "name": "SENSOR_WIDTH",
        "type": "positive",
        "default": "16",
        "minimum": 1
      },
      {
        "name": "DATA_WIDTH",
        "type": "positive",
        "default": "32",
        "minimum": 1
      },
      {
        "name": "THRESHOLD",
        "type": "natural",
        "default": "100",
        "minimum": 0
      }
    ],
    "resolved_defaults": {
      "SENSOR_WIDTH": 16,
      "DATA_WIDTH": 32,
      "THRESHOLD": 100
    }
  },
  "interface": {
    "ports": [
      {
        "name": "clk",
        "direction": "in",
        "type": "std_logic"
      },
      {
        "name": "rst_n",
        "direction": "in",
        "type": "std_logic"
      },
      {
        "name": "trigger",
        "direction": "in",
        "type": "std_logic"
      },
      {
        "name": "sensor_in",
        "direction": "in",
        "type": "std_logic_vector(SENSOR_WIDTH-1 downto 0)"
      },
      {
        "name": "sample_out",
        "direction": "out",
        "type": "std_logic_vector(DATA_WIDTH-1 downto 0)"
      },
      {
        "name": "sample_valid",
        "direction": "out",
        "type": "std_logic"
      },
      {
        "name": "event_irq",
        "direction": "out",
        "type": "std_logic"
      }
    ],
    "clock_ports": [
      "clk"
    ],
    "reset_ports": [
      "rst_n"
    ]
  },
  "contracts": {
    "latency": {
      "kind": "declared_by_block_family",
      "cycles": null
    },
    "throughput": {
      "kind": "declared_by_block_family",
      "transactions_per_cycle": null
    },
    "reset": {
      "policy": "preserve_source_entity_contract"
    },
    "cdc": {
      "status": "single_clock_default; integration CDC review required",
      "clock_domain_count": 1
    },
    "protocol": {
      "status": "not_applicable_or_internal_contract"
    },
    "numerical": {
      "status": "application-specific; reference model required"
    }
  },
  "maturity": {
    "implementation_tier": "B",
    "verification": "static-validated source; run supplied GHDL regression before release.",
    "timing": "requires synthesis, place-and-route, and constraints for the selected FPGA/clock"
  },
  "generation": {
    "wrapper_path": "generated/default_wrappers/sensors_and_instrumentation/threshold_detector_det_cfg.vhd",
    "configuration_file": "configurations/default/threshold_detector.json"
  }
}
